,url,pub_date,title,authors,image,keywords,text
83,https://www.out.com/news-opinion/2019/2/12/jussie-smollett-responds-critics-say-he-lied-about-attack,2019-02-12 00:00:00,UPDATE: Jussie Smollett to Give Post-Attack Interview to Robin Roberts,[],https://www.out.com/sites/out.com/files/2019/02/12/smollett-weho.jpg,"['smollett', 'update', 'representatives', 'roberts', 'jussie', 'smolletts', 'interview', 'chicago', 'records', 'attack', 'victim', 'superintendent', 'postattack', 'statement', 'robin']","UPDATE: Jussie Smollett to Give Post-Attack Interview to Robin Roberts

The actor’s representatives also recently responded to claims he may be lying about his attack with a written statement.

UPDATE (11:50 a.m. EST): Smollett will give his first televised interview following his attack to Good Morning America on Thursday. Below is a clip of the Empire star speaking with Robin Roberts.

ORIGINAL: Weeks after Jussie Smollett said he was attacked by racist and homophobic assailants, representatives from his camp are responding to rumors and social media criticism that the Empire actor might be lying.

“Jussie is the victim here, which has been stated by the Superintendent of Police,” the statement provided to Out reads. “Jussie has voluntarily provided his phone records from within an hour of the attack and given multiple statements to police. Chicago PD has repeatedly informed us that they find Jussie’s account of what happened that night consistent and credible.”

Smollett alleged he had just returned to Chicago early January 29 when around 2 a.m. he left his home to get something to eat from Subway. Upon being recognized as “that faggot Empire n*****?,” sources told TMZ, Smollett was assaulted by two men who poured a clear liquid on him, believed to be bleach, and put his head in a noose. Police confirmed that Smollett said his attackers yelled ""MAGA country"" as they attacked him.

After reporting the incident to police and conducting an initial interview with them, Smollett went to the hospital. Though bruised, he was not admitted and returned home.

A video of Smollett with a rope around his neck returning to his building after the reported incident has been recovered by the police but has yet to be released, according to The Advocate. Local police say they will not release this footage until the investigation in finished.

Police have said they are investigating the incident as a “possible hate crime.” On January 31, they released photos of two “persons of interest.”

The statement from Smollett’s camp comes after the actor-singer turned over phone records that police said were “limited and heavily redacted.” In their report, The Advocate said that the records “have been rejected by local police,” as a result. CPD spokesman Anthony Guglielmi said that “detectives may be following up … to request additional data to corroborate the investigative timeline.”

Smollett’s team contends that any redacted information was done to “protect the privacy of personal contacts or high-profile individuals not relevant to the attack.”

According to ABC7 Chicago, Smollett’s representatives said that ""Chicago Police have not told us that they are rejecting any records, nor have they expressed concerns about the records to us. Therefore, we don't feel compelled to be bated into responding to uncorroborated press reports.”

Read the full statement to Out below:

“Jussie is the victim here, which has been stated by the Superintendent of Police. Jussie has voluntarily provided his phone records from within an hour of the attack and given multiple statements to police. Chicago PD has repeatedly informed us that they find Jussie’s account of what happened that night consistent and credible. Superintendent Johnson has been clear from day one that Jussie is a victim. We are continuing to work closely with the Chicago PD and remain confident that they will find Jussie’s attackers and bring them to justice.

Any redacted information was intended to protect the privacy of personal contacts or high-profile individuals not relevant to the attack.”

RELATED | Jussie Smollett’s Attack Shows Visibility Doesn’t Protect Us"
84,https://www.complex.com/pop-culture/2019/02/jussie-smollett-denies-claims-that-hes-not-cooperating-with-investigators,,Jussie Smollett Denies Claims That He's Not Cooperating With Investigators,[],"https://images.complex.com/complex/images/c_fill,g_center,h_640,w_640/fl_lossy,pg_1,q_auto/lq3fj3765maozs5pb0nx/jussie-smollett","['smollett', 'phone', 'provided', 'jussie', 'investigators', 'took', 'hes', 'chicago', 'im', 'records', 'victim', 'cooperating', 'claims', 'denies', 'information']","Jussie Smollett's representatives are denying claims that Smollett hasn't been cooperating fully with investigators.

A CPD spokesperson said yesterday that the phone records Smollett provided were ""insufficient to corroborate some of the information.” Smollett and his team took offense at the idea that he wasn't giving the police everything that they needed to help find the people who attacked him last month.

""Jussie is the victim here, which has been stated by the Superintendent of Police. Jussie has voluntarily provided his phone records from within an hour of the attack and given multiple statements to police,"" Smollett's reps said, according to Deadline. ""Chicago PD has repeatedly informed us that they find Jussie’s account of what happened that night consistent and credible. Superintendent Johnson has been clear from day one that Jussie is a victim. We are continuing to work closely with the Chicago PD and remain confident that they will find Jussie’s attackers and bring them to justice.""

While representatives admitted that some information may have been redacted on phone records provided by Smollett, they said that those numbers were not germane to the attack.

""Any redacted information was intended to protect the privacy of personal contacts or high-profile individuals not relevant to the attack,"" they said. ""Chicago Police have not told us that they are rejecting any records, nor have they expressed concerns about the records to us. Therefore, we don’t feel compelled to be baited into responding to uncorroborated press reports.""

Smollett recently performed for the first time since he was attacked. He took the stage at West Hollywood's Troubadour.

""The most important thing that I can say is to keep it simple and say thank you and I’m okay,"" Smollett said. ""I’m not fully healed yet, but I’m going to and I’m going to stand strong with you all. I had to be here tonight. I couldn’t let those motherf*ckers win."""
85,https://www.staradvertiser.com/2019/02/12/news/jussie-smollett-says-he-redacted-phone-files-to-protect-privacy/,2019-02-12 00:00:00,Jussie Smollett says he redacted phone files to protect privacy,['Associated Press'],https://www.staradvertiser.com/wp-content/uploads/2019/02/web1_8178439-4500bb4d968f49e7ba49e145ad588ecd-300x221.jpg,"['smollett', 'privacy', 'jussie', 'redacted', 'chicago', 'turned', 'protect', 'records', 'files', 'attack', 'video', 'area', 'phone', 'statement']","CHICAGO >> Jussie Smollett today said he redacted some information from his phone before giving it to Chicago police investigating a reported attack on the “Empire” actor in order to protect the privacy of contacts and people who are not relevant to the attack.

Smollett’s representatives issued a statement a day after police said the heavily redacted phone records he turned over to detectives this week were insufficient for a criminal investigation.

The statement is the latest in a back-and-forth between Smollett and police since he reported the attack in downtown Chicago on Jan. 29. Police have made no arrests and said they have found no surveillance video that shows the attack. They have released video of two people in the area at the time who they said were persons of interest.

“Jussie is the victim here, which has been stated by the Superintendent of Police,” the statement said. “Jussie has voluntarily provided his phone records from within an hour of the attack and given multiple statements to police.”

But Chicago police spokesman Anthony Guglielmi said Monday that the phone records turned over by Smollett are in a heavily redacted document file and the records from the manager Smollett says he was talking to when the attack occurred were a screenshot of phone calls. He says the records aren’t sufficient for an investigation.

Smollett’s statement said he had good reasons for turning over limited information.

“Any redacted information was intended to protect the privacy of personal contacts or high-profile individuals not relevant to the attack,” his statement said.

Smollett, who is black and openly gay, told police that his attackers doused him with an unknown chemical substance, shouted racial and homophobic slurs at him before and looped a thin rope tied like a noose around his neck. Smollett also told detectives that before they ran off, the attackers yelled “This is MAGA country, ” a reference to the “Make America Great Again” slogan President Donald Trump uses.

Smollett and his family have insisted that he has been truthful about the attack and his story has not changed since it happened.

Police have collected video surveillance footage from cameras in the downtown area and have also extended their search to stores in the area in the hopes of gathering evidence on who might have purchased the rope."
86,https://www.naturalnews.com/2019-02-12-its-time-for-the-chicago-pd-to-charge-jussie-smollett-for-fabricating-a-hate-crime.html,2019-02-12 00:00:00,"It’s time for the Chicago PD to charge Jussie Smollett for fabricating a hate crime (The evidence demonstrates the attack, as alleged, never happened)","['News Editors', 'Tuesday', 'February']",https://www.naturalnews.com/wp-content/uploads/sites/91/2019/02/Pulled-Over-Police-Car.jpg,"['smollett', 'hate', 'went', 'jussie', 'broken', 'happened', 'chicago', 'attack', 'crime', 'fabricating', 'evidence', 'department', 'actor', 'noose', 'demonstrates', 'pd']","(Natural News) It’s time for the Chicago Police Department to stop wasting taxpayer resources investigating what is obviously a fabricated hate crime and charge Jussie Smollett with making a false statement to police.

(Article by Tom Elliott republished from News.Grabien.com)

To quickly recap: Smollett, an openly gay actor and musician who stars in the Fox show, “Empire,” recently claimed he was the victim of a horrific hate crime perpetuated by Trump-supporting thugs. Besides acting, Smollett is well known for being an outspoken critic of President Trump.

According to the account relayed to the celebrity gossip site, TMZ, Smollett was attacked upon leaving a Chicago Subway sandwich shop around 2 AM. The masked attackers, he says, recognized him, hurled racial and homophobic epithets at him (”Empire f*gg*t n*gger!”), beat him up, tied a noose around his neck, poured bleach on him, and said triumphantly, “This is MAGA Country!”

The original report said his rib was broken in the attack and he was recovering in a hospital. Smollett also told police that in the days before the attack, he received a death threat in the mail. That letter was signed “MAGA,” the same thing he says his attackers yelled. The letter itself used letters from magazines to conceal the sender’s handwriting:

Image via Best TV News

News of the attack immediately went viral, and celebrities worldwide used the incident to denounce what they described as growing intolerance of minorities.

But as people clamored for more information, Smollett started clamming up. The Chicago Police Department opened an investigation, with an assist from the FBI, only to find the actor extremely uncooperative. What evidence they did turn up only served to undermine Smollett’s story.

Sponsored solution from the Health Ranger Store: The Big Berkey water filter removes almost 100% of all contaminants using only the power of gravity (no electricity needed, works completely off-grid). Widely consider the ultimate ""survival"" water filter, the Big Berkey is made of stainless steel and has been laboratory verified for high-efficiency removal of heavy metals by CWC Labs, with tests personally conducted by Mike Adams. Explore more here.

During a performance at Chicago’s Troubadour Theater days after the attack, Smollett read a prepared statement acknowledging parts of his original story were untrue. Smollett admitted his ribs were not actually broken and that he never went to the hospital.

“A couple of points I wanted to make really quick; just because — four points,” he said before performing an encore. “I was bruised but my ribs were not cracked, they were not broken. I went to the doctor immediately, my friend Gatson [sp?] drove me. I was not hospitalized. Both my doctors in LA and Chicago cleared me to perform but said to take care obviously. But above all, I fought the f*ck back.”

Investigators also failed to locate any evidence corroborating Smollett’s claims. Security footage reviewed by the Chicago Police Department show a gap where the actor was walking, disappeared from camera, and returned one minute later with a noose around his neck. For an attack as brutal as Smollett described, this is a very small time window for so much to have occurred.

The Chicago Police Department say security footage show the actor returning to his apartment still clutching the Subway sandwich he had bought before the incident, which many found surprising since he had just apparently undergone a horrific ordeal in which he “fought the f*ck back” against racist thugs. That his attackers happened to randomly run into him at 2 AM while carrying the perfect accessories for an anti-black hate crime — bleach and a noose — also struck many as odd, especially as a cold spell meant Chicago temperatures were well below zero that night.

Read more at: News.Grabien.com"
87,https://www.amren.com/news/2019/02/is-empire-star-jussie-smolletts-story-falling-apart/,2019-02-13 02:25:21+00:00,Is ‘Empire’ Star Jussie Smollett’s Story Falling Apart?,[],https://i1.wp.com/www.amren.com/wp-content/uploads/2017/06/ARLogo.png?fit=800%2C800&ssl=1,"['smollett', 'reported', 'jussie', 'star', 'falling', 'empire', 'smolletts', 'investigation', 'report', 'records', 'false', 'attack', 'apart', 'phone', 'hoax']","Tyler O'Neil, PJ Media, February 12, 2019

Chicago police say they will be requesting more phone records from “Empire” star Jussie Smollett regarding the racist and homophobic attack he allegedly faced two weeks ago. Smollett has turned over heavily redacted phone records, but evidence has begun to emerge suggesting his story was fabricated. Rumors are swirling that police are even considering charging him with filing a false report.

{snip}

Weigel had previously reported that the police superintendent plans to hold Smollett accountable if the investigation reveals he made a false report. “[Chicago Police Superintendent] Eddie Johnson says [Jussie Smollett] is still being treated as the victim in this case but if the investigation does reveal he made a false report he will be held accountable,” he tweeted. That threat seems more likely.

Late Monday evening, ABC7 Chicago reported that an empty hot sauce bottle that smelled like bleach was found near the location of the alleged attack. Smollett had told police that the attackers — who wore “Make America Great Again” hats and screamed “This is MAGA country!” — had poured an unknown bleach-smelling liquid on him and put a noose around his neck after they yelled racist and homophobic slurs at him at 2 a.m. on January 29.

{snip}

As for the phone records, Guglielmi said, “We are very appreciative of the victim’s cooperation, however, the records provided do not meet the burden for a criminal investigation as they were limited and heavily redacted. Detectives may be following up with him to request additional data to corroborate the investigative timeline.”

Chicago police have not been able to identify any legitimate suspects in the case, nor have they been able to find any surveillance footage of the attack. There is speculation that the hot sauce bottle may have been placed after the fact to prop up the hoax if Smollett indeed made a false report.

{snip}

Many Americans are waking up to the possibility that Jussie Smollett’s story may be a hoax. Jeff Giesea, an entrepreneur who has written for NATO and the Harvard Business Review, tweeted, “The weight of evidence supports what we’ve suspected all along: This is a hate hoax. [Jussie Smollett] should be arrested for filing a false police report & sued. In this era of disinfo, these hoaxes and their media enablers must be held accountable.”

Conservative blogger Matt Walsh laid out the basic incongruity of Smollett’s story: “he claims he was attacked by white Trump-loving racists in one of the most liberal parts of one of the most liberal cities in America. No similar attacks have been reported by anyone in the town.”

{snip}

Quillette’s Andy Ngo noted that the very person who said he could hear the attackers over the phone himself refused to let police examine the phone."
