,url,pub_date,title,authors,image,keywords,text
25,https://www.thewrap.com/jussie-smollett-attack-naacp-president-derrick-johnson-demonizing-victim/,2019-02-13 20:25:58-08:00,NAACP President on Media Coverage of Jussie Smollett Attack Story: ‘Verging on Demonizing a Victim’,"['Jennifer Maas', 'Itay Hod', 'Tony Maglio']",https://www.thewrap.com/wp-content/uploads/2019/02/Jussie-Smollett-Derrick-Johnson.jpg,"['smollett', 'president', 'naacp', 'johnson', 'jussie', 'smolletts', 'coverage', 'reporting', 'demonizing', 'attack', 'victim', 'media', 'intolerance', 'crimes', 'verging', 'image']","Jussie Smollett was nominated for his eighth NAACP Image Award on Wednesday morning — shortly after he sat down with “Good Morning America” for his first interview since reporting to police he was assaulted by two men on Jan. 29.

Following the announcement of the “Empire” star’s Outstanding Supporting Actor nod for his performance on the Fox drama, TheWrap spoke with NAACP president Derrick Johnson about the list of nominations — and his opinion on how the press is covering Smollett’s story.

“It’s unfortunate, the media is verging on demonizing a victim,” Johnson told us during the Television Critics Association press tour. “And in order for us to truly root out racial hate crimes and crimes based on homophobia, we need not to demonize the victim. We need to aggressively pursue a course of action that if, in fact, individuals committed these crimes they are held accountable, as well as pursue a course of action in the media to allow people to understand that we must have more tolerance and acceptance of all citizens.”

Also Read: Jussie Smollett to Appear on 'GMA' for First Interview Since Reporting Attack (Exclusive)

In terms of how the NAACP Image Awards, which will be broadcast live on TV One on March 30, will address Smollett’s story during the telecast, Johnson isn’t sure yet. But he says the topic isn’t specific to the “Empire” star, even though the story of the potential hate crime against him is currently receiving a significant amount of media attention.

“It’s just not Jussie’s situation, it’s a current climate of intolerance. [The] NAACP, primary to our mission is [to] fight against discrimination. So as we develop the script for the show I am almost positive, as we do every year, [that it will] address the current trend of intolerance, whether it’s racial intolerance, xenophobia, homophobia or gender bias. Those are important issues that we’ve taken on and it will be a thread throughout the show.”

See the full list of NAACP Image Award nominations here."
26,https://www.goodmorningamerica.com/culture/video/jussie-smollett-speaks-robin-roberts-abc-news-exclusive-61052883,,Jussie Smollett tells ABC News' Robin Roberts he's 'pissed off' after vicious attack,['Good Morning America'],https://s.abcnews.com/images/GMA/190213_gma_jussie_intv1_hpMain_16x9_992.jpg,"['smollett', 'roberts', 'jussie', 'abc', 'hes', 'attack', 'vicious', 'tells', 'robin', 'pissed']",
27,https://www.billboard.com/articles/news/pride/8498293/jussie-smollett-first-interview-chicago-attack-good-morning-america-preview,2019-02-13 15:10:14-05:00,Jussie Smollett Says He's 'Pissed Off' in First Post-Attack Interview,['Stephen Daw'],https://www.billboard.com/files/media/jussie-smollett-may-2017-billboard-1548.jpg,"['smollett', 'morning', 'roberts', 'truth', 'jussie', 'interview', 'hes', 'thing', 'records', 'attack', 'good', 'postattack', 'robin', 'pissed']","The full interview will air on Thursday's ""Good Morning America.""

In the two weeks since Empire actor Jussie Smollett was attacked in Chicago, the Internet has been swept up in the reported crime. Many have sent messages of support to Smollett, some have commented on what they perceive as strange and misleading details about the case, and Smollett has remained relatively quiet.

But now, Smollett has given his first interview since the attack. Helmed by ABC’s Robin Roberts, the interview will air on Good Morning America on Thursday morning. The interview will focus on the attack, the ensuing police investigation and the social response to the news.

In an early clip released from the interview, Smollett said he was ""pissed off"" and spoke about his frustration with those who claim he fabricated the attack to gain fame. ""It's like, you know, at first, it was a thing of, like, 'Listen, if I tell the truth then that's it, 'cause it's the truth,’"" he said. “Then it became a thing of like, 'Oh, how can you doubt that? Like, how do you -- how do you not believe that? It's the truth.’ And then it became a thing of like, 'Oh, it's not necessarily that you don't believe that this is the truth, you don't even want to see the truth.'""

Recent reports from the Chicago Police Department show that Smollett handed over his official phone records, but that police found the heavily redacted records “insufficient” and asked for more. Smollett’s team issued a statement following the attack, reiterating the actor’s commitment to finding the perpetrators and his “consistent and credible” story.

Watch Jussie Smollet’s full interview with Robin Roberts on Thursday at 8 a.m. ET on ABC’s Good Morning America, and check out an early clip below:"
28,https://variety.com/2019/music/news/jussie-smollett-pissed-off-first-interview-since-attack-1203138713/,2019-02-13 20:15:35+00:00,Jussie Smollett Reveals He’s ‘Pissed Off’ in First Interview Since Attack,['Margeaux Sippell'],https://pmcvariety.files.wordpress.com/2019/02/jussie-smollett-good-morning-america.jpg,"['oh', 'smollett', 'roberts', 'truth', 'reveals', 'jussie', 'stand', 'interview', 'hes', 'thing', 'troubadour', 'report', 'attack', 'told', 'yall', 'pissed']","In his first interview since he was attacked on Jan. 29, Jussie Smollett sat with ABC News’ Robin Roberts to share his feelings about the incident and address the rumors that he might not be telling the truth about the attack, which is being investigated as a possible hate crime. The full segment will air Thursday morning on “Good Morning America.”

“I’m pissed off,” the actor told Roberts. “It’s like, you know, at first, it was a thing of, like, ‘Listen, if I tell the truth then that’s it,’ ’cause it’s the truth. Then it became a thing of like, ‘Oh, how can you doubt that? Like, how do you — how do you not believe that? It’s the truth,'” he said.

“And then it became a thing of like, ‘Oh, it’s not necessarily that you don’t believe that this is the truth, you don’t even want to see the truth.”

Smollett, 36, plays a gay man on the Fox series “Empire,” and came out as gay himself in 2015. The police report details that the attackers approached him at 2 a.m., made homophobic slurs against him and hit him in the face with their hands. The attackers have yet to be identified.

According to the report, “The primary aggressor was wearing a black mask concealing any facial features and both offenders were dressed in black. The victim does not remember any other distinguishing features of the offenders, or in which direction they fled.”

Since the attack, Smollett has mostly stayed out of the public eye, stepping out only once to perform at the Troubadour in Los Angeles on Feb. 2.

“I’m not fully healed yet…but I’m going to be, and I’m gonna stand strong with y’all,” he told the crowd at the Troubadour. “I had to be here tonight, y’all. I couldn’t let those [expletive] win,” he added. “Regardless of what anyone else says, I will only stand for love and I hope that you all stand with me.”

Watch the excerpt below."
29,https://www.thewrap.com/jussie-smollett-tells-robin-roberts-hes-pissed-off-how-do-you-not-believe-that-video/,2019-02-13 20:05:43-08:00,Jussie Smollett Tells Robin Roberts He's 'Pissed Off' (Video),['Itay Hod'],https://www.thewrap.com/wp-content/uploads/2019/02/jussie-abc-er-190213_hpMain_16x9_992.jpg,"['smollett', 'roberts', 'jussie', 'smolletts', 'hes', 'redacted', 'interview', 'chicago', 'read', 'records', 'protect', 'video', 'phone', 'tells', 'robin', 'pissed']","In his first interview since reporting that he was attacked by two men in Chicago, Jussie Smollett said he was “pissed off” at what he called “attacks” from those who may have doubted his account.

As TheWrap first reported, “Good Morning America” anchor Robin Roberts snagged the first interview with the “Empire” star since he told police that he was attacked in Chicago’s Streeterville neighborhood while walking to his apartment. According to Smollett, two men attacked him while yelling racial and homophobic slurs and referencing “MAGA.” A police statement said chemicals were poured on the “Empire” star’s face, and a rope placed around his neck.

But Smollett’s account has been questioned after the Chicago Police Department said the actor was slow to turn over material pertinent to the investigation.

Also Read: Jussie Smollett to Appear on 'GMA' for First Interview Since Reporting Attack (Exclusive)

“What is it that has you so angry? Is it the…attackers?” Roberts asked.

“Attackers, but it’s also the attacks,” Smollett responded. “It’s like, you know, at first, it was a thing of, like, ‘Listen, if I tell the truth then that’s it, ’cause it’s the truth.’ Then it became a thing of like, ‘Oh, how can you doubt that? Like, how do you– how do you not believe that? It’s the truth.'”

Police had asked for Smollett’s phone records because he said he was on a call with his manager, Brandon Z. Moore, during the attack.

On January 31, two days after the incident, CPD said that detectives “were not able to independently verify the statements as cell phone records were not provided to investigators when asked. Therefore we are not able to confirm this.”

Also Read: Jussie Smollett Says He Gave Police Redacted Phone Records to 'Protect the Privacy of Personal Contacts'

Smollett did eventually turn over his phone records. But Chicago police said they were too heavily redacted to be useful to their investigation. A Chicago police spokesman, Anthony Guglielmi, said in a statement, “We are very appreciative of the victim’s cooperation however the records provided do not meet the burden for a criminal investigation.”

On Tuesday, Smollett’s publicists pushed back, saying that the actor was only trying to protect “the privacy of personal contacts.”

“Any redacted information was intended to protect the privacy of personal contacts or high-profile individuals not relevant to the attack,” his reps said in a statement.

Also Read: Jussie Smollett Turns Over 'Limited and Redacted' Phone Records, Police Say

Smollett’s full interview with “GMA” airs Thursday at 7 a.m. EST."
30,https://ew.com/tv/2019/02/13/jussie-smollett-gma-interview/,2019-02-13 00:00:00,Jussie Smollett 'pissed off' that some doubt his attack: 'It's the truth',['James Hibberd'],https://ewedit.files.wordpress.com/2019/02/jussie.jpg?crop=0px%2C0px%2C2868px%2C1506px&resize=1200%2C630,"['oh', 'smollett', 'morning', 'roberts', 'truth', 'doubt', 'jussie', 'interview', 'thing', 'attack', 'believe', 'dont', 'phone', 'pissed']","Jussie Smollett has some strong words for anybody who doubts he was the victim of a hate crime in Chicago last month.

The Empire actor tells Robin Roberts at Good Morning America in an advance preview of his upcoming interview that he's ""pissed off"" by suggestions that he might not have been truthful in his police report.

""What is it that has you so angry? Is it the…attackers?"" Roberts asked.

""Attackers, but it's also the attacks,"" Smollett replied. ""It's like, you know, at first, it was a thing of, like, ‘Listen, if I tell the truth then that's it, 'cause it's the truth.' Then it became a thing of like, ‘Oh, how can you doubt that? Like, how do you — how do you not believe that? It's the truth.' And then it became a thing of like, ‘Oh, it's not necessarily that you don't believe that this is the truth, you don't even want to see the truth.'""

The 36-year old, who plays a gay musician on the Fox drama, says he was attacked by two unidentified assailants while walking home around 2 a.m. on Jan. 29. He said the attackers abused him with racial and homophobic slurs, hung a rope around his neck, and doused him with a liquid that might have been bleach. An ongoing police investigation has been unable to find surveillance footage of the attack or suspects matching Smollett's description yet also do not have the actor's entire walk home on camera. There's also been some delay in Smollett giving the police his phone records in a form that the authorities find acceptable (he says he was on the phone with his manager at the time of the attack). Some outlets have suggested Smollett might have perpetuated a ""hoax.""

Smollett's full interview will air Thursday morning on GMA."
31,http://www.justjared.com/2019/02/13/jussie-smollett-speaks-out-in-first-interview-post-attack-video-im-pissed-off/,2019-02-13 00:00:00,Jussie Smollett Speaks Out in First Interview Post-Attack (Video): 'I'm Pissed Off',[],http://cdn01.cdn.justjared.com/wp-content/uploads/headlines/2019/02/jussie-smollett-speaks-out-post-attack1.jpg,"['tell', 'smollett', 'truthjussie', 'truth', 'jussie', 'interview', 'speaks', 'thing', 'im', 'thats', 'video', 'believe', 'dont', 'postattack', 'tomorrowjussie', 'pissed']","Jussie Smollett is giving his first on-air interview after his suspected hate crime late last month.

“I’m pissed off. It’s the attackers, but it’s also the attacks. Like, you know, at first it was the thing of like, listen, if I tell the truth then that’s it because it’s the truth. Then it became a thing of, like, how can you doubt that? How can you not believe that? It’s the truth,” Jussie said during an interview on Good Morning America. The full interview will be airing tomorrow.

Jussie added, “Then it became a thing of, like, it’s not necessarily that you don’t believe that this is the truth. You don’t even want to see the truth.”

Jussie previously spoke out about the incident a few days after it happened."
32,https://theblast.com/jussie-smollett-gma-interview-first-clip/,2019-02-13 11:36:36+00:00,Jussie Smollett Doesn't Understand People Who Don't Believe Him: 'You Don't Even Want to See the Truth',"['Theblast Staff', 'Whitney Vasquez', 'Mike Walters', 'Ryan Naumann']",https://i0.wp.com/theblast.com/wp-content/uploads/2019/02/021319_jussie_smollett_gma_tout.jpg?fit=1460%2C1095&ssl=1,"['oh', 'smollett', 'morning', 'understand', 'roberts', 'truth', 'jussie', 'interview', 'thing', 'attack', 'believe', 'dont', 'doesnt']","

Jussie Smollett is baffled by the people who have responded to the news of his attack by doubting his story.

In the first clip of his interview with Robin Roberts for ""Good Morning America,"" Smollett was asked what has him so angry about the reaction to his story.

""It's attackers, but it's also the attacks,"" Smollett began. ""It's like. you know, at first, it was a thing of, like, 'Listen, if I tell the truth then that's it, 'cause it's the truth.'""

He continued, ""Then it became a thing of like, 'Oh, how can you doubt that? Like, how do you, how do you not believe that? It's the truth.' And then it became a thing of like, 'Oh. It's not necessarily that you don't believe that this is the truth, you don't even want to see the truth.'""

Smollett's full interview with Roberts airs Thursday morning on ""Good Morning America.""

RELATED LINKS

• Jussie Smollett Speaks Out for the First Time Since His Attack: 'I Still Believe That Justice Will Be Served'

• Jussie Smollett's Family Lashes Out Against 'Violent and Unprovoked Attack,' Calling It 'Domestic Terrorism'

• President Donald Trump Calls Attack on ‘Empire’ Star Jussie Smollett ‘Horrible’"
33,https://globalnews.ca/news/4957457/rich-the-kid-usher-studio-shooting/,,"Rich the Kid targeted in robbery, shooting outside studio where Usher was recording","['Katie Scott', 'Global News', 'Posted February']",https://shawglobalnews.files.wordpress.com/2019/02/rich-the-kid-usher.jpg?quality=70&strip=all&w=720&h=379&crop=1,"['outside', 'recording', 'usher', 'studio', 'shooting', 'kid', 'west', 'rapper', 'robbery', 'hollywood', 'fired', 'victims', 'targeted', 'rich']","Send this page to someone via email

Rapper Rich the Kid and his entourage were involved in a shooting and robbery at a West Hollywood studio in Los Angeles where Usher was recording Tuesday afternoon.

According to Variety, the Plug Walk rapper and his entourage were the targets of the robbery, which took place outside of Westlake Recording Studio.

The attack was a robbery targeting Rich the Kid, who was outside the studio at the time, according to reports.

READ MORE: Jussie Smollett responds to accusations he lied about attack

At the time of the incident, Usher was inside the studio and not involved.

A representative for Rich the Kid confirmed that the 26-year-old rapper is OK.

The Los Angeles County Sheriff’s Department posted a description of the robbery but did not mention Rich the Kid or Usher in the report.

Story continues below advertisement

According to authorities, the victims said that three suspects confronted them in the alley behind the studio and “demanded their money and jewelry. The victims were then physically assaulted by the suspects.”

READ MORE: 21 Savage released from ICE detainment on bond, lawyers say

The shooting reportedly occurred as the suspects fled the scene.

We are investigating reports of shots fired near Santa Monica Bvd at Greenacre Ave. We are attempting to locate a victim at this time. Further info to follow. — LASD West Hollywood (@WHDLASD) February 13, 2019

According to reports obtained by TMZ, who was first to report the story, a man was seen running away from the studio and fired as many as 10 gunshots. No one was hit.

Calls came in at around 3:15 p.m. reporting shots fired in the area of Santa Monica Boulevard at Greenacre Avenue, the Sheriff’s Department said.

No one was taken to the hospital but several victims were treated for minor injuries at the scene, including Rich the Kid’s bodyguard. The bodyguard was reportedly beaten with a firearm.

READ MORE: Nicki Minaj cancels BET headline slot after network’s offensive Cardi B tweet

Just hours before the attack, the New Freezer rapper posted a photo of himself holding a large stack of money in front of a Lamborghini with the caption, “Always in bank mo deposit ^.”

Story continues below advertisement

No arrests have been made and police are currently investigating the attack.

Anyone with information is encouraged to call the West Hollywood station at 310-855-8850. To leave an anonymous tip, call Crime Stoppers at 800-222-8477."
34,https://www.eurweb.com/2019/02/jussie-smollett-tears-up-in-first-interview-with-gma-since-attack-watch/,2019-02-13 17:40:28+00:00,Jussie Smollett Tears Up in First Interview (with GMA) Since Attack – WATCH,"['Fisher Jack', 'Ny Magee']",https://i1.wp.com/www.eurweb.com/wp-content/uploads/2019/02/jussie-smollett-tears-up-gma1.jpg?fit=624%2C410&ssl=1,"['smollett', 'tears', 'watch', 'officers', 'horne', 'kwiatkowski', 'jussie', 'interview', 'mack', 'gma', 'week', 'public', 'attack', 'white', 'officer', 'black', 'lives']","*Embattled Buffalo (New York) Police Department’s past is coming back to haunt them during George Floyd protests.

Last week two officers from the BPD were seen on a viral video violently pushing an elderly man to the ground during a protest.

On Saturday June 6, 2020, the officers – part of the tactical team that responds to protests and civil unrest – plead not guilty to second-degree assault charges and were released without bail. After the decision to charge the officers, the remaining members of the tactical team resigned. (See EUR coverage here).

While grappling with that, the BPD now must answer to some old police brutality questions that have plagued the department for years – and one of the cases involves Cariol Horne back in 2006.

Horne, who has been interviewed heavily while protesting George Floyd’s police brutality death, was not a usual suspect. She (a black woman) was a police officer coming up for retirement after 19 years on the BPD when she came across a fellow white officer (Officer Gregory Kwiatkowski) beating and choking a detained black man (Neal Mack) in a reported domestic disturbance call.

RELATED: Minneapolis Police Chief Can’t Release George Floyd Bodycam + He’s Fighting with Police Union on Reform

Last week in an interview with WBEN, Horne said of the incident, “You are taught to use only the force necessary to effect an arrest. These officers are going above and beyond because they are beating people who are handcuffed. It was the same situation with Neal Mack. He was handcuffed and being beaten, that’s why I stopped the chokehold.”

After a lengthy two-year investigation, in 2008, Horne was fired just short of being eligible for her pension for violating a suspect’s rights. She apparently jumped on the officer’s back to stop him from choking Mack. Kwiatkowski retaliated by punching her in the face. Horne describes what happened in the below video from 2014.

MORE NEWS: Vanessa Bryant: Pro Athletes Sliding in DMs of Kobe Bryant’s Widow

Horne reflects on what is happening today with the recent protests that are about ongoing police brutality and social injustices.

“Black people scream about it all day every day and you have white people who are sympathetic to our calling to say yea all lives matter but black lives are the ones being brutalized right now so we need attention on black lives,” Horne told Spectrum News earlier this week. “So, when white people understand that and want to jump in on the movement, it’s like come on.”

Now a truck driver with five children, Horne’s been fighting the good fight. She hopes to pass Cariol’s Law which would protect officers who report fellow officers abuse of suspects and others. She is also hoping that state laws will be changed that protect police discipline records from going public.

“If you are a public servant, your record should not be private, especially when you are dealing with the public,” Horne told WBFO. “So, if you are a police officer and you are dealing with someone, it makes no sense to keep the record private, because you are out in the public. It only makes sense.”

So, what ever happened to the white police officer in Horne’s case? Gregory Kwiatkowski (now retired) was convicted of attacking four young black men during an arrest a few years after his incident with Horne. He was sentenced only to four months in prison plus four months of home confinement. The sentence could have carried a maximum penalty of 10 years in prison and a fine of $250,000.

For more on Cariol Horne’s story, go to her website here."
