,url,pub_date,title,authors,image,keywords,text
26,https://www.outfrontmagazine.com/trending/jussie-smollett-fights-back/,2019-02-04 17:52:17+00:00,Jussie Smollett Fights Back,"[""Addison Herron-Wheeler Is Out Front'S Editor"", 'Friend To Dogs Everywhere. She Enjoys Long Walks In The Darkness Away Any Sources Of Sunlight', 'Rainy Days', 'Painfully Dry Comedy. She Also Covers Cannabis', 'Heavy Metal', 'Is Author Of Wicked Woman', 'Women In Metal The To Now.']",https://i2.wp.com/www.outfrontmagazine.com/wp-content/uploads/2019/02/34050240_1719797614764481_6843216343844519936_o.jpg?fit=1620%2C1080&ssl=1,"['smollett', 'fights', 'jussie', 'tonight', 'thing', 'say', 'im', 'thats', 'attack', 'surrounding', 'love', 'stand']","Despite suffering a homophobic and racist attack just last week, Empire start Jussie Smollett believes the show must go on. He made his first public appearance since the attack this past Saturday night.

“The most important thing that I can say is to keep it simple and say thank you and I’m okay,” Smollett said to the Troubadour crowd last weekend. “I’m not fully healed yet, but I’m going to, and I’m going to stand strong with you all.”

Jussie Smollett speaks out on inaccuracies surrounding his attack. pic.twitter.com/xHYW8Q5bBy — Entertainment Tonight (@etnow) February 3, 2019

“I had to be here tonight,” he added. “I couldn’t let those motherf*ckers win! I will always stand for love; I will never stand for anything other than that. Regardless of what anyone else says, I will only stand for love, and I hope you will all stand with me.”

He also directly addressed the crowd about rumors surrounding the attack.

“There’s been a lot of stuff that’s been said about me that’s absolutely not true,” he said. “I was bruised, but my ribs were not cracked; they were not broken. I went to the doctor immediately… I was not hospitalized. Both my doctors in L.A. and Chicago cleared me to perform, but said to take care, obviously. And above all, I fought the f*ck back.”

In addition to this proud moment, Chicago police have now recovered a recording of the attack according to TMZ, and hope to try and identify the attackers based on the footage.

Throughout this terrible ordeal, one thing remains clear: Smollett is a fighter, and racists and homophobes don’t stand a chance against him."
27,https://www.wral.com/ellen-page-condemns-pence-for-his-stance-on-gay-marriage/18163448/,2019-02-01 16:33:18-05:00,Ellen Page condemns Pence for his stance on gay marriage :: WRAL.com,['Julie Gallagher'],https://wwwcache.wral.com/presentation/v3/images/content/social/open_graph/wral_news5_1920x1080.jpg,"['stance', 'ellen', 'president', 'marriage', 'vice', 'going', 'school', 'lgbtq', 'pences', 'pence', 'gay', 'page', 'condemns', 'individuals', 'wife', 'wralcom']","— Ellen Page takes Vice President Mike Pence's views on gay marriage personally, and she's fed up.

In an emotional interview on ""The Late Show Stephen Colbert"" Thursday night, the ""Juno"" actress told Colbert that it was hard to not be ""fired up,"" given the president and vice president's outlook on LGBTQ issues.

""The Vice President of America wishes I didn't have the love with my wife. He wanted to ban that in Indiana,"" Page said.

Page, who identifies as gay, spoke of her wife of one year.

She suggested Pence's beliefs and rhetoric contribute to the prejudice and violence many LGBTQ individuals face.

""Connect the dots,"" Page said. ""Kids are going to be abused and they're going to kill themselves and people are going to be beaten on the street.""

Page cited the reported attack against ""Empire"" actor Jussie Smollett, who told police he was attacked by two men this week while they called him racist and homophobic slurs.

""This needs to f***ing stop,"" Page concluded as she choked up. She was met with a large applause from the audience.

CNN has reached out to the vice president's office for comment on Page's statements, but has not heard back.

Pence is a conservative Christian, and while Governor of Indiana he signed the Religious Freedom Restoration Act. Critics of the law contend it could be used by individuals and businesses to discriminate -- particularly against the community of lesbian, gay, bisexual and transgender individuals -- on the basis of religion.

His wife, Second Lady Karen Pence, recently came under fire for accepting a job as an art teacher at a private Christian school that bars LGBTQ students and employees.

At the time, Kara Brooks, Pence's communications director, said the attention paid to the school's agreement is ""absurd.""

""Mrs. Pence has returned to the school where she previously taught for 12 years. It's absurd that her decision to teach art to children at a Christian school, and the school's religious beliefs, are under attack,"" Brooks said in a statement to CNN. She did not answer when asked by CNN if Pence agreed with the policy."
28,https://www.chicagotribune.com/news/local/breaking/ct-met-jussie-smollett-alleged-attack-20190204-story.html,2019-02-04 00:00:00,"Week before reported attack, Jussie Smollett got threatening letter with 'MAGA' written for return address","['Rosemary Sobol', 'Tracy Swartz']",https://www.trbimg.com/img-5c587289/turbine/ct-met-jussie-smollett-alleged-attack-20190204,"['letter', 'attack', 'subway', 'jussie', 'smolletts', 'walk', 'shop', 'images', 'smollett', 'reported', 'return', 'streeterville', 'area', 'spotted', 'maga', 'track', 'week', 'stretches', 'written', 'threatening']",Detectives have checked more than a dozen cameras in the Streeterville area but had yet to find any footage of an attack. They have been able to track stretches of Smollett’s walk between the Subway shop and his apartment building and have spotted two other people in the area at the time. But the images are dark and blurry.
29,https://etcanada.com/news/415003/damon-wayans-jr-apologizes-as-anti-lgbtq-tweets-resurface/,2019-02-04 11:53:00,Damon Wayans Jr. Apologizes As Anti-LGBTQ Tweets Resurface,['Martin Holmes'],https://shawetcanada.files.wordpress.com/2019/02/damon-wayans-jr.png?w=720&h=480&crop=1,"['tweets', 'continue', 'jr', 'glamorous', 'wayans', 'hart', 'working', 'homophobic', 'antilgbtq', 'lgbtq', 'kevin', 'apologizes', 'company', 'resurface', 'damon']","Damon Wayans Jr. is apologizing for his discriminatory remarks toward the LGBTQ community after a number of insensitive tweets have resurfaced.

The tweets in question, which use slurs such as “tranny” and “fag,” resurfaced after the CW network announced Wayans as executive producer of its new show, “Glamorous”, about a gender-nonconforming protagonist.

RELATED: Kevin Hart Slams Backlash After Telling Jussie Smollett To ‘Stay Strong’ Following Homophobic Attack

Out magazine, who first reported the story, said that the tweets (most of which were posted in 2010 and 2011) were deleted after the publication reached out to Wayans’ representatives for comment.

In a statement, the 36-year-old actor-comedian told Out, “When I was a young comic trying to find my voice, I made some immature and hurtful tweets that I deeply regret at the expense of the LGBTQ community.

“When I tweeted those comments, almost 10 years ago, I was unaware of the emotional impact they could have. I am not excusing that behaviour but that is not who I am today. Society evolved and so have I and it is something I will continue to do both personally and professionally.”

He added: “You know better, you do better.”

RELATED: Terry Crews Says Kevin Hart Needs To ‘Acknowledge The Pain Of Other People’

The news comes just months after Kevin Hart stepped down as Oscar host after his past homophobic tweets resurfaced. Hart, who initially tried to ignore the situation, eventually offered an apology when turning down the role as host.

“I sincerely apologize to the LGBTQ community for my insensitive words from my past. I’m sorry that I hurt people… I am evolving and want to continue to do so,” he wrote.

Hart later told Ellen DeGeneres that he had already apologized for the comments years ago and that’s why he was reluctant at first to address the situation, as he didn’t want to go over the subject again.

RELATED: Sarah Silverman Insists She’s ‘Done’ Using Homophobic Slang After Kevin Hart Controversy: ‘I Can Find Other Ways To Be Funny’

Wayans’ new show, “Glamorous”, comes from his production company Two Shakes, and follows a gender-nonconforming high-school graduate who winds up working as an intern for a cosmetics company they once dissed on YouTube.

In his statement, Wayans said, “I am very proud of the work we are doing at Two Shakes entertainment. The company was founded with the mission of working with diverse voices, both in front and behind the camera.

“When ‘Glamorous’ was pitched to us I thought it was brilliant, heartwarming, and important. We will continue to be committed to pursuing protagonists who don’t traditionally get to be at the centre of a show and bringing their stories to the screen.”"
30,https://nylon.com/demi-lovato-21-savage-memes,,Demi Lovato Deletes Twitter After Backlash Following Her 21 Savage Comments,[],https://nylon-img.rbl.ms/simage/https%3A%2F%2Fassets.rbl.ms%2F19144299%2F1200x600.jpg/2000%2C2000/2eTxUU9PYIi3lBl4/img.jpg,"['funny', 'lovato', 'backlash', 'demi', 'writing', 'joke', 'took', '21', 'tweeted', 'deletes', 'savage', 'memes', 'twitter', 'following', 'comments']","Demi Lovato deleted Twitter after she received backlash for her comments about rapper 21 Savage.

The singer tweeted Sunday night that her favorite part of the Super Bowl were the memes being made about 21 Savage. The rapper was detained by the U.S. Immigration and Customs Enforcement earlier that day and reportedly faces deportation for overstaying his visa. Understandably, many people on Twitter didn't think the situation was something to laugh about.

Rapper Wale tweeted, ""Why is somebody freedom funny…. I don't get the joke."" While Offset appeared to subtweet Lovato, writing, ""ALL THE MEMES AND SHIT AINT FUNNY WHEN SOMEBODY GOING THROUGH SOME PRAYING FOR MY DAWG AINT SHIT FUNNY HIS FANILY DEPENDING ON HIM.""

Following this, Lovato took to Twitter to clarify her tweet, explaining that she was referring to the memes that poked fun at 21 Savage being British, not his deportation. She also called out the people in her comments talking about her drug use—the singer was hospitalized in July following an alleged overdose—in response to her comments. ""If you're gonna come at me for making a joke, try coming at me with something original not involving drugs,"" she wrote. ""Fuck Twitter. This is why I don't tweet anymore.""

After deleting her Twitter, she took to Instagram to explain herself even more, writing, ""Wasn't laughing at anyone getting deported. I know that's not a joke.. not have I EVER laughed at that. The meme I posted/was talking about was of him being writing with a feather pen. Sorry if I offended anyone. But it's no excuse to laugh at someone's addiction let alone their OD.""

You can see her response in full below."
31,http://www.x17online.com/2019/02/jussie_smollett_performance_troubadour_investigation_hate_crime_attack_gay_empire_photos_video_020419,,Investigation Into Hate Crime On Empire Star Jussie Smollett Continues - X17 Online,[],http://www.x17online.com/media/images//2019/02/jussie-smollett-troubadour.jpg,"['empire', 'troubadour', 'attack', 'hate', 'investigation', 'jussie', 'continues', 'chicago', 'ribs', 'true', 'told', 'smollett', 'went', 'broken', 'star', 'online', 'crime', 'x17', 'phone']","Empire actor Jussie Smollett, who was the victim of a hate crime in Chicago last week which saw him beaten, the subject of a racist verbal attack that ended in a noose being tied around his neck and a trip to the ER, gave a performance at LA's Troubadour club Saturday night and tons of fans showed up to support himAs Chicago police continue their investigation into the hate crime, Smollett took the opportunity of being on stage with fans and reporters listening, to make a statement. He told the crowd: ""There has been a lot of stuff said about me that’s absolutely not true. I’m sure my lawyer’s sitting up there like, ‘No, Jussie, no! No! Shut the f*** up and sing! I was bruised but my ribs were not cracked; they were not broken. I went to the doctor immediately. . . . I was not hospitalized. Both my doctors in L.A. and Chicago cleared me to perform, but said to take care, obviously. And above all: I fought the f*** back.""Some claim Jussie's story has changed over the brief course of the investigation and have been critical of some details they say are inconsistencies. Immediately after the attack reports said Smollett suffered broken ribs, which the actor now says isn't true. He told the Troubadour audience he went to the ER but was never diagnosed with broken ribs. Others criticize details like his Subway sandwich being intact following the attack and the claim that his cell phone was knocked to the ground but proof that he returned to his hotel with his cell phone intact.Police reportedly have security camera video of Smollett returning to his hotel after the attack ... so, it seems, more will be revealed in this case soon!"
32,https://people.com/tv/taraji-p-henson-told-jussie-smollett-to-walk-in-truth-after-apparent-hate-crime/,,Taraji P. Henson Told Jussie Smollett to 'Walk in His Truth' After Apparent Hate Crime,['Jodi Guglielmi'],https://peopledotcom.files.wordpress.com/2019/01/gettyimages-473036068.jpg?crop=0px%2C61px%2C1800px%2C947px&resize=1200%2C630,"['smollett', 'truth', 'hate', 'jussie', 'p', 'walk', 'im', 'thats', 'henson', 'told', 'crime', 'taraji', 'win', 'love', 'stand']","The actress, who stars as Smollett’s mother on the Fox series Empire, gave an update on Smollett while appearing on the Today show Monday morning.

Get push notifications with news, features and more.

“Life is spiritual warfare and we’re seeing it right before our very eyes. You just have to stay close to what you know,” she said. “Jussie is love, that’s who he is. That’s all he knows. In this situation, hate won’t win. It will not.”

Henson said she told Smollett to make sure he doesn’t forget who he is as he heals.

“I just told him to walk in his truth. To just stay the Jussie that everybody loves,” she said. “You saw the outpour of love that he has. He’s touched a lot of people in his career. I just told him, ‘Walk in your truth, baby, no one can take that from you.’ ”

Smollett made his first public appearance since the attack on Saturday, performing at the Troubadour in Los Angeles. He addressed the terrifying incident.

“There are so many words on my heart that I want to say,” the 35-year-old said, visibly emotional. “The most important that I can say, to keep it simple, thank you so much. I’m okay … I’m not fully healed yet, but I’m going to. I’m going to stand strong with y’all.”

Image zoom Taraji P. Henson and Jussie Smollett Gilbert Carrasquillo/FilmMagic

“I had to be here tonight,” he added. “I couldn’t let those motherf—ers win. So I will always stand for love, I will never stand for anything other than that. Regardless of what anyone else says, I will only stand for love. I hope that you all stand with me.”

He also clarified reports about the apparent hate crime.

“Just because there has been a lot of stuff that has been said about me that is absolutely not true,” he said. “There are just a couple of points that I wanted to make really quick… I was bruised, but my ribs were not cracked. I went to the doctor immediately — I was not hospitalized. Both my doctors in L.A. and Chicago cleared me to perform but said to take it easy, obviously. And, above all, I fought the f— back.”"
33,https://www.vanityfair.com/hollywood/2019/02/damon-wayans-jr-homophobic-anti-lgbtq-tweets-statement,,"Damon Wayans Jr. Addresses Old, Anti-Gay Tweets as CW Preps His New, Queer Pilot","['Laura Bradley', 'Laura Bradle']",https://media.vanityfair.com/photos/5c585c04cec32271820c70bf/16:9/pass/damon-wayans-jr.jpg?mbid=social_retweet,"['host', 'tweets', 'continue', 'jokes', 'jr', 'preps', 'pilot', 'wayans', 'hart', 'past', 'antigay', 'cw', 'old', 'statement', 'queer', 'damon']","Just a couple months after Kevin Hart decided he would rather relinquish his title as Oscar host than apologize for his past homophobic tweets, Damon Wayans Jr. has been forced to address his own past anti-L.G.B.T.Q. remarks. As Out reports, the comedian has a history of such comments, which includes the frequent use of the word “tranny” and the phrase “no homo.” To make matters more complicated, the CW also just ordered a pilot about a gender-nonconforming protagonist—with Wayans on board as an executive producer.

In a statement, Wayans told Out, “When I was a young comic trying to find my voice, I made some immature and hurtful tweets that I deeply regret at the expense of the LGBTQ community. When I tweeted those comments, almost 10 years ago, I was unaware of the emotional impact they could have.”

“I am not excusing that behavior,” Wayans continued, “but that is not who I am today. Society evolved and so have I and it is something I will continue to do both personally and professionally. Continued learning, acceptance and thoughtful words are all important actions that will help make society a kinder and safer place for all people. You know better, you do better.”

Early last December, soon after Hart was announced as this year’s Oscar host, his past homophobic tweets resurfaced. Rather than apologize for the remarks, Hart decided to abdicate the position of M.C.—though he did eventually issue a mea culpa on Twitter: “I sincerely apologize to the LGBTQ community for my insensitive words from my past. I’m sorry that I hurt people . . . I am evolving and want to continue to do so,” he wrote as he stepped down from the Oscars.

Hart later insisted to Ellen DeGeneres that he’d already apologized for the old jokes years ago, drawing support from the Ellen host, who tried to get him reinstated as host. The conversation sparked backlash for DeGeneres, whose decision to advocate for Hart made some wonder if she may actually be as out of touch as her recent comedy special humorously suggested she is. When Jussie Smollett was brutally attacked last week, onlookers pointed out that violence like this is precisely the reason that jokes like Hart’s should not be dismissed out of hand. (Hart had said, among other things, that he would beat his son if he turned out to be gay.)

Wayans has adopted a more contrite approach than Hart did, even if his statement stops short of giving a direct apology. YouTuber and trans-rights activist Kat Blaque also said on Sunday that she had seen Wayans telling transphobic jokes around four or five months ago at the Laugh Factory in Los Angeles. When reached by email, representative for Wayans said that Damon Wayans Jr. has not performed at The Laugh Factory in over a year, maybe two, and noted that Damon Sr. no longer performs stand-up comedy.

Wayans’s new CW show, Glamorous, comes from his production shingle Two Shakes, and follows a gender-nonconforming high-school graduate whose first post-grad internship winds up being with a cosmetics company they once publicly dissed on YouTube. Wayans concluded his statement by writing, “I am very proud of the work we are doing at Two Shakes entertainment. The company was founded with the mission of working with diverse voices, both in front and behind the camera. When Glamorous was pitched to us I thought it was brilliant, heartwarming and important. We will continue to be committed to pursuing protagonists who don’t traditionally get to be at the center of a show and bringing their stories to the screen.”

A representative for the CW did not immediately respond to V.F.’s request for comment.

This post has been updated.

More Great Stories from Vanity Fair

— Our critic on why movies are still magic

— Alan Alda just wants to have a good conversation

— Former Trump Zelig Hope Hicks begins her second act on the West Coast

— See an exclusive preview of Quentin Tarantino’s ninth film

— Your passport to Vanity Fair’s 25th Hollywood Issue with Saoirse Ronan, Timothée Chalamet, Chadwick Boseman, and more

Looking for more? Sign up for our daily Hollywood newsletter and never miss a story."
34,https://www.kron4.com/news/national/jussie-smollett-performs-in-la-and-tells-the-crowd-he-wants-to-clarify-a-few-things/1753943360,2019-02-04 15:23:55+00:00,Jussie Smollett performs in LA and tells the crowd he wants to clarify a few things,"['Maureen Kelly', 'Cnn Newsource', 'Kate Rooney']",https://media.kron4.com/nxs-krontv-media-us-east-1/photo/2019/02/04/Jussie_Smollett_performs_in_LA_and_tells_0_71044436_ver1.0_1280_720.jpg,"['smollett', 'clarify', 'hate', 'jussie', 'wants', 'week', 'im', 'attack', 'told', 'crowd', 'actor', 'la', 'gay', 'love', 'statement', 'performs', 'tells', 'things']","(CNN) — Actor and musician Jussie Smollett performed at his first show since his reported attack last week, tearfully telling fans at the event in Southern California that he is not fully healed but he is doing OK.

The “Empire” actor said Tuesday that he was attacked by two men who were “yelling out racial and homophobic slurs” in what Chicago police are investigating as a possible hate crime. He identifies as gay and plays a gay character on the series.

Smollett said one of his attackers put a rope around his neck and poured an unknown chemical substance on him.

During his concert Saturday night at West Hollywood’s Troubadour club, Smollett told fans that he wanted to clarify that following the attack, he was bruised but his ribs were neither cracked nor broken. He also said that he went to the doctor immediately, but he wasn’t hospitalized, and physicians in both Chicago and Los Angeles cleared him to perform at the concert.

“I’m not fully healed yet,” he said. “But I’m going to (be), and I’m gonna stand strong with y’all.”

Smollett: ‘I can’t let attackers win’

Smollett thanked the more than 300 people gathered at the event and struck a defiant note.

“I had to be here tonight, y’all, I couldn’t let those (expletives) … win,” he said, referring to his attackers. “Above all I fought … (expletive) back.”

He reiterated his calls for love, telling fans they needed to do away with hate because love is the only thing they had.

“I don’t even care to name any names,” he said. “The hateful rhetoric that gets passed around, it has to stop. But guess what, it stops with the people that believe in love.”

After the encore, an impassioned Smollett told the crowd, now is the time to be “blacker and gayer.”

Smollett praised openly gay TV actor Wilson Cruz of “My So-Called Life” for inspiring him.

Cruz, who was in attendance, said, “I’m unbelievably proud of him. If I was able to inspire him as a young person to be able to be his fullest self, that is a point of pride for me for the rest of my life.”

Sofie Khan, who is Mexican-Pakistani and identifies as bisexual, said she was amazed by Smollett’s performance.

“The emotion, the energy,” she said. “Look at all the people coming out. Black, white, Asian, gay, straight — the whole vibe of the people who were all there in love.”

While this was Smollett’s first public appearance since the attack, this is not the first time he has spoken out. In a statement first published by Essence on Friday, Smollett said his attack wasn’t an isolated incident.

“These types of cowardly attacks are happening to my sisters, brothers and non-gender conforming siblings daily,” he said in the statement.

“During times of trauma, grief and pain, there is still a responsibility to lead with love. It’s all I know,” he said.

The investigation

Earlier this week, Smollett addressed speculation that he had changed his initial story and was less than forthcoming with authorities.

“I am working with authorities and have been 100% factual and consistent on every level,” he said. “Despite my frustrations and deep concern with certain inaccuracies and misrepresentations that have been spread, I still believe that justice will be served.”

Smollett’s family issued a statement Thursday supporting the actor and condemning the attack, calling it a “racial and homophobic hate crime.”

“Jussie has told the police everything from the very beginning,” the statement read. “His story has never changed, and we are hopeful they will find these men and bring them to justice.”

Chicago police have released photos of potential persons of interest in the attack and are asking for the public’s help in identifying who they are.

Investigators said they have video of Smollett entering the hotel after the alleged attack with what appears to be a noose around his neck.

CNN’s Don Lemon spoke to Smollett last week, and the actor told him he was shaken and angry that an attack like this could happen. He told him that he fought back against the attackers.

CNN’s Chris Boyette, Sandra Gonzalez and Ryan Young contributed to this report.

WHAT OTHERS ARE CLICKING ON:

>>MORE STORIES"
