,url,pub_date,title,authors,image,keywords,text
14,https://www.realclearpolitics.com/articles/2019/02/04/republicans_must_denounce_the_bigotry_of_the_pences_139361.html,2019-02-04 00:00:00,Republicans Must Denounce the Bigotry of the Pences,[],https://assets.realclear.com/images/47/470385_5_.jpg,"['virginia', 'views', 'school', 'religious', 'yearbook', 'pences', 'pence', 'gay', 'state', 'washington', 'bigotry', 'men', 'republicans', 'denounce']","WASHINGTON -- I have a question for those Republicans who, along with Democrats, demand the resignation of Virginia Democratic Gov. Ralph Northam for the abhorrent photo that appeared on his page in his medical school yearbook: If bigotry is repugnant, why not demand the resignation of Vice President Mike Pence for his ugly views on homosexuality? And while they're at it, why not insist that Pence's wife resign her position at a school that discriminates against gays and lesbians?

I can guess their answer: Pence and his wife are deeply religious, and their views on homosexuality are based on their religious convictions. To this, I say, so what? The Bible was used to justify slavery, and in my own time, racists cited this or that biblical passage to assert that racial segregation was precisely what God intended -- the so-called ""curse of Ham"" or the ""mark of Cain,"" both used to add biblical authority to the rantings of bigots. Now the mark or the curse is on the Pences, who share views that in our nation's history have caused much suffering, including violence.

The other thing Republicans would be sure to say is that racism is different than ""mere"" anti-gay bias. Yes, indeed. Richmond was the capital of the Confederacy. Virginia is the state that once led the nation in number of slaves. The inhumanity of slavery is hard to fathom. It's harder still to comprehend that great men -- Washington, Jefferson, Madison ... you know the names -- not only condoned it, but benefited from it.

Later came slavery's progeny -- the Jim Crow era. I am talking of everything from the absurdity of segregated state parks to the barbarity of lynchings. In Atlanta in 1899, a black man was mutilated and then burned with portions of the body distributed to the crowd. The man's name was Sam Hose. He was probably innocent of murder but not, of course, of being black.

The destructive power of blackface and KKK robes in that yearbook picture cannot be underestimated. But let's ponder, too, the harm of hateful homophobia. It has taken countless lives over the years, caused huge suffering and, like racism, persists to this day.

Homophobia is a staple of the racist right -- Nazis, white nationalists and other adherents of mindless goonery -- and results in the murder of gay and transgender people. In 2017, 20 gay, bisexual and queer men were murdered in hate crimes, an increase of 400 percent from 2016. This problem is hardly going away. And, infamously, in 1998, Matthew Shepard, was beaten, tortured and left to die on account of being gay. Last year, his ashes were interred in the Washington National Cathedral in a ceremony presided over by a gay Episcopal bishop, with music provided by Washington's Gay Men's Chorus.

And when racial hatred and homophobia are combined, the results can be particularly disturbing. Last week, singer and actor Jussie Smollett was attacked in Chicago by two men who allegedly yelled anti-gay and anti-black epithets.

Pence has been long been criticized as hostile to LGBTQ issues. He has linked same-sex couples to a ""societal collapse"" and even once seemed to support conversion therapy, which is a form of torture. A vice president who has expressed such intolerance is a dangerous model.

In certain corners of the right-wing media, criticism of Karen Pence for recently taking a job at the Immanuel Christian School in Springfield, Virginia, was denounced as nothing less than religious bigotry. After all, the argument went, the school was a (BEG ITAL)Christian(END ITAL) school, ultra-conservative and ultra-traditional, which was entitled to teach according to its deeply held beliefs. No doubt. But while America has traditionally given religion wide berth -- and still does -- lines have been drawn. Utah was not admitted as a state until the Church of Jesus Christ of Latter-day Saints renounced polygamy.

No one is advocating a law requiring Immanuel Christian to practice tolerance, both in its pedagogy and its hiring practices. But the First Amendment that guarantees the school's rights also gives us the right to criticize. It is simply wrong to foster a belief that homosexuality and same-sex marriage are immoral.

I have been torn about Northam -- about whether a single yearbook photo negates a lifetime of tolerance. But I am not torn about Mike and Karen Pence. They are figures of consequence and their bigotry -- regardless of their religious justification -- has to be confronted.

(c) 2019, Washington Post Writers Group"
15,https://www.digitalmusicnews.com/2019/02/04/secretly-distribution-signs-amped-distribution/,2019-02-04 00:00:00,Secretly Distribution Signs with AMPED Distribution for Physical Releases,"['Daniel Is An Avid Writer Who Was Born', 'Raised In Los Angeles.', 'Alongside Writing', 'He Is Also A Passionate Reader', 'An English Teacher For Ell Students. He Dedicates His Spare Time To Raising His Three Bagirls.']",https://www.digitalmusicnews.com/wp-content/uploads/2019/02/Secretly-Distribution.jpg,"['distribution', 'deal', 'physical', 'recordings', 'secretly', 'releases', 'signs', 'records', 'amped', 'secretlys', 'music']","Secretly Distribution Signs with AMPED Distribution for Physical Releases

Secretly Distribution has brushed off its deal with Warner/ADA to join AMPED Distribution.

Secretly Distribution, an indie music company, has exited its physical deal with Warner Music’s ADA. In Warner’s place is a new distribution partnership with AMPED Distribution.

Under terms of the agreement, the indie music company has moved over 50 active labels to the Florida-based distributors. AMPED will now handle Secretly’s physical distribution covering thousands of new releases. Releases include Sharon Van Etten, Bon Iver, Sufjan Stevens, Angel Olsen, Tycho, Wild Nothing, Helado Negro, Mac Demarco, and Mitski, among many other artists.

AMPED already has existing deals with Kobalt’s AWAL, Believe, Bloodshoot, Cleopatra, Compass, Culture Factory, Empire, Fuel, Hopeless, IDLA, IDOL, Inner Knot, Kartel, Liger, Lindsey Stirling, Mad Decent, Manifesto, Merge, mTheory, No Sleep, Pearl, Rat Pak, Red House, Ruf, Secretly Distribution, Shanachie, SM Entertainment, Soulfood, TFE, Tuff Gong, The Holland Group, Urban Digital, Virtual Label, We Are Hear, and Yellow Sound/Broadway Records, among many others.

Labels serviced by Secretly include 2062, Acephale, Arbutus Records, Asthmatic Kitty, Awesome Tapes From Africa, Bayonet, Captured Tracks, Chapter Music, Cloud Recordings, Constellation, DFA Records, Dead Oceans, Family Vineyard, FatCat Records, Felte, Ghostly International, Ghost Ramp, Jagjaguwar, Joyful Noise Recordings, K Records, Magnetic South, No Quarter, Numero Group, Paradise of Bachelors, Post Present Medium, Quarterstick Records, Quite Scientific Records, RVNG Intl., Sacred Bones Records, Secretly Canadian, Sounds Familyre, Suicide Squeeze Records, Temporary Residence Ltd., Tomlab, Touch and Go Records, Tri Angle, Trouble In Mind, Underwater Peoples, Unseen Worlds, Western Vinyl, and Winspear.

Speaking about its new distribution partnership, Shelly Westerhausen, Secretly’s Head of North American Physical Sales and Marketing, explained,

“We’ve aligned with a partner that shares Secretly’s deep commitment to the physical marketplace as we continue to expand on so many great opportunities for our labels and artists.”

Dean Tabaac, Head of AMPED Distribution, added,

“AMPED’s ability to connect Secretly’s impressive roster of par excellence artists with fans wherever they shop is the core of who we are and we are elated that Secretly feels the same way.”

Warner/ADA previously handled Secretly’s physical distribution to Amazon and US big-box store accounts.

It remains unclear why Secretly Distribution walked away from the now-expired deal instead of renewing it."
16,http://www.justjared.com/2019/02/04/taraji-p-henson-reveals-what-she-told-jussie-smollett-after-he-was-attacked/,2019-02-04 00:00:00,Taraji P. Henson Reveals What She Told Jussie Smollett After He Was Attacked,[],http://cdn01.cdn.justjared.com/wp-content/uploads/headlines/2019/02/henson-told.jpg,"['smollett', 'studios', 'truth', 'reveals', 'jussie', 'p', 'attacked', 'today', 'youfyi', 'walk', 'york', 'henson', 'told', 'taraji', 'siriusxm']","Taraji P. Henson wears a colorful skirt while leaving NBC Studios following an appearance on The Today Show on Monday morning (February 4) in New York City.

The Empire actress was on the show to promote her new film What Men Want, in theaters this weekend. Taraji later went to SiriusXM Studios for another interview.

On Today, Taraji opened up about what she told her co-star Jussie Smollett after he was attacked in Chicago last week.

“I just told him to walk in his truth, just stay the Jussie that everybody loves,” she said. “And you saw the outpour of love that he had, so he has touched a lot of people, in his career. So, I just told him just walk in your truth, baby, no one can take that from you.”

FYI: Taraji is wearing Mother denim and Adeam boots at SiriusXM."
17,https://abcnews.go.com/US/video/jussie-smollett-returns-stage-1st-time-reported-attack-60833831,,Jussie Smollett returns to the stage for 1st time since reported attack Video,['Abc News'],https://s.abcnews.com/images/US/190204_abcnl_debrief_perez_hpMain_16x9_992.jpg,"['saying', 'smollett', 'picture', 'authorities', 'know', '1st', 'reported', 'jussie', 'case', 'happened', 'returns', 'lot', 'really', 'video', 'attack', 'jesse', 'stage', 'neighborhood']","Transcript for Jussie Smollett returns to the stage for 1st time since reported attack

I think small way that empire star triumphantly returned. To the stage he said that he would not be beaten down and he thinks that justice will come. And attackers and that. Shouted homo phobic slurs and and racist slurs at him. Let's hear a little bit from his concert over the weekend. Really. Really bringing. Bringing all of his talent and gifts for the audience there and ABC's Alex Perez has been following this case there in Chicago. Let's look the latest what are what are police saying and what does Jesse saying to his fans. Dateline Iowa you know still no arrest in this case we're in Chicago's straighter road neighborhood it was in this neighborhood where Jesse reported. That crime now there are cameras everywhere every square inch of this neighborhood a lot of businesses here also big residential area as you can see and authorities at this point it does not appear that that attack was captured on any of the cameras are still searching reviewing. Hours and hours of video looking for any possibility. Of that but as you mentioned this is the first time we're hearing just east speak publicly. About what happened to him back on January 29 he was performing in West Hollywood as thinking quick listen to what he told some of the people in the audience this weekend. Assists from was I was bruised ribs we're not crass. Humor not broken. Both my doctors in LA and Chicago Putin's reform visit to take care obviously. And boom fall. And. So many claim that you heard there Jesse is resilient Seattle on I eight lot of questions he's resilience. He says he fought back and he says he does expect that justice will be served in this case but. He was it merely saying this was an emotional emotional time for him and his scrambling. Am absolutely. Can. And I was starting to say that that there are still questions about who those two gentlemen. Are in that surveillance tape can you tell us anything more about that. Yes still a lot of things we just don't know about this case authorities release that surveillance image is a still picture that shows. Two people walking but it it's a grainy picture and really just looks like two silhouettes and authorities released that last week at this point they still have not gone any tips they're no closer to identifying her as we know who those two people in that picture are. And they say those people may just be witnesses to what happened naturally trying to get ahold of them we still don't really know anything about who the actual. Suspects in this case may have been. Authorities thought they have about a dozen detectives working this case like I said this is a busy area a lot of people. So if something happened here as it appears it did they want to know. Who is responsible and get those people off the streets. Thanks for staying on top of all of it. Alex.

This transcript has been automatically generated and may not be 100% accurate."
18,https://www.dailymail.co.uk/usshowbiz/article-6666551/Jussie-Smollett-pictured-heavy-security-making-return-stage-following-attack.html,2019-02-04 18:48:35+00:00,Jussie Smollett pictured with heavy security after making return to stage following attack,"['Caitlyn Becker', 'Caitlyn Becker For Dailymail.Com']",https://i.dailymail.co.uk/1s/2019/02/04/18/9383780-0-image-a-50_1549306058919.jpg,"['smollett', 'jussie', 'making', 'star', 'empire', 'performance', 'pictured', 'return', 'heavy', 'attack', 'crowd', 'family', 'following', 'security', 'love', 'stage']","Jussie Smollett was flanked by security as he made his return to the stage on Saturday following a brutal attack last week.

The Empire star sang in front of a sold-out house at the Troubadour in West Hollywood, California in his first public appearance since he was the victim of a hate crime on Tuesday in Chicago.

Police were stationed outside of the show where the 35-year-old performed and Jussie was escorted out of the venue by security.

Safety: Jussie Smollett was flanked by security as he made his return to the stage on Saturday following a brutal attack last week

Jussie was seen as he headed out into the rain following his emotional performance, protected by security guards.

The star was joined by his family and Lee Daniels as they ducked out of the West Hollywood club.

Jussie pulled the hood of a grey sweatshirt over his head as he departed into a waiting crowd.

Armed officers stood watch at the entrance of the Troubadour and several patrol cars were spotted on the street.

Back to work: The Empire star sang in front of a sold-out house at the Troubadour in West Hollywood, California in his first public appearance since he was the victim of a hate crime

Support: Film producer Lee Daniels (back right) stuck close to Smollet's side as he left the venue

During the performance, the Empire star was joined on the stage by his siblings, who introduced him and embraced him.

'My family and I have realized that tonight is an important part of Jussie's healing. You see, he's been a fighter since he was a baby,' his brother Joel Smollett Jr said.

Before singing a note, Jussie teared up as he told the crowd he's not fully healed yet, but he will be, and his music will help him.

Protection: Police were stationed outside of the show where the 35-year-old performed

Cops: Several patrol cars were spotted parked outside of the Troubadour

Keeping the peace: Armed officers were on hand to make sure the star and the crowd was safe

'I couldn't let the motherf**kers win,' he said, to loud screams from the audience. 'So I will always stand for love, I will never stand for anything other than that.'

Last week Jussie reported to police in Chicago that two masked men attacked him and put a rope around his neck while using homophobic and racial slurs.

Rep. Maxine Waters, a California Democrat, sat in the crowd with Smollett's family. Also in attendance were actor Jai Rodriguez and film producer Lee Daniels.

Moving on: Jussie was seen as he headed out into the rain following his emotional performance, protected by security guards

Together: The star was joined by his family and Lee Daniels as they ducked out of the West Hollywood club

Daniels was later seen sticking close to Smollett as he left the club.

During the performance, Smollett thanked his boyfriend for supporting him over the past four days, and sang as song he wrote for the boyfriend called Haha (I Love You).

Smollett said he fought back against his attackers, and called himself the 'gay Tupac,' referring to the rapper who was gunned down in 1996.

The actor said that his ribs had been bruised, but not broken as TMZ had previously reported.

Family support: Jussie's mom Janet was spotted exiting the performance with her family

'My family and I have realized that tonight is an important part of Jussie's healing. You see, he's been a fighter since he was a baby,' his brother Joel Smollett Jr said

'Be as black, be as brown, be as gay as the f**k you want to be!' he said to end the set.

On Tuesday, Jussie reported that he was attacked in Chicago as he walked home from a Subway restaurant.

The actor, who is gay and black, said he was punched, had bleach poured on him and had noose put around his neck.

Standing by: Jussie's brother was spotted leaving the Troubadour after the show

Standing together: During the performance, the Empire star was joined on the stage by his siblings, who introduced him and embraced him

Moments later, he was filmed walking into his building with a rope hanging loosely around his neck.

On Friday, Smollett broke his silence to thank fans for the outpouring of support he has received since the alleged attack.

The Empire star told Essence in a statement: 'Let me start by saying that I'm OK.

Gratitude: During the performance, Smollett thanked his boyfriend for supporting him over the past four days, and sang as song he wrote for the boyfriend called Haha (I Love You)

Performing: Smollett told the crowd 'I couldn't let these motherf**kers win' tho thunderous applause

'My body is strong but my soul is stronger. More importantly I want to say thank you.

'The outpouring of love and support from my village has meant more than I will ever be able to truly put into words.'

He added that while he was 'frustrated' with 'certain inaccuracies and misrepresentations' about the case, he believes 'justice will be served.'

Honesty: Smollett told the crowd that he hasn't fully healed yet but that he's on his way

Tragic: On Tuesday, Jussie reported that he was attacked in Chicago as he walked home from a Subway restaurant

' 'I am working with authorities and have been 100% factual and consistent on every level.

'Despite my frustrations and deep concern with certain inaccuracies and misrepresentations that have been spread, I still believe that justice will be served.

Jussie Smollett, pictured in the hospital hours after the attack on Tuesday, has returned to the stage in Los Angeles

'As my family stated, these types of cowardly attacks are happening to my sisters, brothers and non-gender conforming siblings daily.

'I am not and should not be looked upon as an isolated incident.

'We will talk soon and I will address all details of this horrific incident, but I need a moment to process.'

'Most importantly, during times of trauma, grief and pain, there is still a responsibility to lead with love. It's all I know. And that can't be kicked out of me.

'With Love, respect & honor…Jussie,' he said.

It is the first time he has spoken since being targeted in downtown Chicago by two men who he said shouted 'this is MAGA country!' and attacked him as he walked home.

A week before the attack, Smollett reportedly received a homophobic and racist death threat in the mail.

'Photos (pictured) of people of interest who were in area of the alleged assault & battery of Empire cast member,' police spokesman Anthony Guglielmi tweeted Wednesday evening

It was sent to the studio where he films Empire and is said to have terrified staff.

The letter was dated from January 18, and stated 'You will die black f*g' in cut out letters.

Cops said the mail threat was laced with powder substance that turned out t but crushed Tylenol.

Police are working to find two men they believe may be responsible and are appealing to the public for information.

The attacks are believed to be premeditated as Smollett received a cut out letter, that appears to be dated from January 18, stating that 'You will die black f*g'. Fox Studio received the letter on the 22nd and cops said it was laced with powder Tylenol

The attack has enraged the country and even caught the attention of the president who deemed it 'horrible' on Thursday.

'That's horrible....there is nothing worse, as far as I am concerned,' Trump said on when asked about the incident.

The term MAGA, which was written on the threatening letter and allegedly yelled by the attackers, is an acronym for President Trump's Make America Great Again slogan and a moniker adopted by his supporters.

Smollett's famous family released a statement abhorring the attack, and countless celebrities, including his Empire co-stars, have also spoken out to support him."
19,http://www.necn.com/entertainment/entertainment-news/An-Instagram-Famous-Egg-and-Hulu-Shed-Light-on-Mental-Health--505310852.html,2019-02-04 12:01:04+00:00,An Instagram-Famous Egg and Hulu Shed Light on Mental Health,['Sierra Jackson'],https://media.necn.com/images/1200*675/AP_HuluTVApp.jpg?ak=bc,"['team', 'post', 'record', 'mental', 'hulu', 'light', 'instagram', 'shed', 'million', 'health', 'egg', 'instagramfamous', 'world']","This Instagram famous egg is taking a crack at discussing mental health.

In a 30-second-long Hulu spot released on Super Bowl Sunday, Eugene the egg appeared with cracks fracturing his shell.

“Recently I’ve started to crack,” the egg said. “The pressure of social media is getting to me. If you’re struggling too, talk to someone.”

The egg then directed viewers to Mental Health America’s website.

Since Jan. 18, the egg account has been posting photos showing that cracks in its shell have been increasingly worsening.

The video was also posted on the World Record Egg Instagram account and the caption pointed Instagram users to visit talkingegg.info to find a detailed list of mental health organizations around the world.

The talking egg first gained popularity as a stock photo when it started an Instagram campaign to have a post with more likes than Kylie Jenner’s post of her newborn daughter. Jenner’s post previously held the world record for the most-liked Instagram post with nearly 18 million likes. The World Record Egg’s first post has since amassed more than 52 million likes.

Chris Godfrey, a 29-year-old employee at a London-based advertising agency called The&Partnership, has been revealed to be the owner of the World Record Egg account. He’s also had help from his friends Alissa Khan-Whelan, 26, and C.J. Brown, 29, The New York Times reported.

""World_Record_Egg started as something fun to challenge and question social media from the creators at Egg Gang, but quickly turned into an opportunity to give the world a bit of hope and positivity,"" the creators wrote in a press release emailed to NBC.

The team added that the goal of their first project was ""to raise awareness around social media and its impact on mental health, encouraging people to speak up when they need to.""

Mental Health America took to Instagram to thank the World Record Egg for shedding a light on mental health.

“Not everyone chooses to #fightintheopen for mental health, but you did for the 1 in 5 Americans living with a mental health condition,” the caption read. “Thank you, #EggGang!”

Erin Wallace, Mental Health America’s chief communications officer, said the organization was excited when the team behind A World Record Egg asked if they could list Mental Health America on the Hulu clip.

“The reaction has been great, and we are thrilled that World Record Egg used its big reveal to shine a light on mental health,” Wallace wrote via email. “[World Record Egg] has an incredible following, and we applaud the creator for using the platform for such an important message.”

CNBC and others reported that the Instagram account's more than 10 million followers also made it an appealing investment for marketing companies looking to advertise their products to a global audience.

""Being the first brand to crack out of the egg is worth at least $10 million,"" VaynerMedia's head of direct-to-consumer business Nik Sharma told The Atlantic.

Sharma had predicted that advertisers might be more willing to invest in the egg than in the Super Bowl.

The fact that Hulu is paying the egg's team, as reported by the New York Times, is an example of the financial benefit the egg can bring to its creators.

""We chose to partner with Hulu because they gave us the opportunity to spread our message,"" reads the press release, ""and most importantly, do so on the Egg’s terms."""
