,url,pub_date,title,authors,image,keywords,text
54,https://www.breitbart.com/entertainment/2019/02/13/jussie-smollett-reps-say-he-is-the-victim-here-as-chicago-police-say-his-phone-records-limited-and-redacted/,2019-02-13 00:00:00,Jussie Smollett Reps Say He Is ‘The Victim Here’ as Chicago Police Say His Phone Records ‘Limited and Redacted’,['Breitbart News'],https://media.breitbart.com/media/2019/01/jussie-smollett-persons-interest.jpg,"['smollett', 'reps', 'limited', 'jussie', 'redacted', 'chicago', 'turned', 'records', 'attack', 'victim', 'video', 'area', 'say', 'phone', 'statement']","CHICAGO (AP) — Jussie Smollett on Tuesday said he redacted some information from his phone before giving it to Chicago police investigating a reported attack on the “Empire” actor in order to protect the privacy of contacts and people who are not relevant to the attack.

Smollett’s representatives issued a statement a day after police said the heavily redacted phone records he turned over to detectives this week were insufficient for a criminal investigation.

The statement is the latest in a back-and-forth between Smollett and police since he reported the attack in downtown Chicago on Jan. 29. Police have made no arrests and said they have found no surveillance video that shows the attack. They have released video of two people in the area at the time who they said were persons of interest.

“Jussie is the victim here, which has been stated by the Superintendent of Police,” the statement said. “Jussie has voluntarily provided his phone records from within an hour of the attack and given multiple statements to police.”

But Chicago police spokesman Anthony Guglielmi said Monday that the phone records turned over by Smollett are in a heavily redacted document file and the records from the manager Smollett says he was talking to when the attack occurred were a screenshot of phone calls. He says the records aren’t sufficient for an investigation.

Smollett’s statement said he had good reasons for turning over limited information.

“Any redacted information was intended to protect the privacy of personal contacts or high-profile individuals not relevant to the attack,” his statement said.

Smollett, who is black and openly gay, told police that his attackers doused him with an unknown chemical substance, shouted racial and homophobic slurs at him before and looped a thin rope tied like a noose around his neck. Smollett also told detectives that before they ran off, the attackers yelled “This is MAGA country, ” a reference to the “Make America Great Again” slogan President Donald Trump uses.

Smollett and his family have insisted that he has been truthful about the attack and his story has not changed since it happened.

Police have collected video surveillance footage from cameras in the downtown area and have also extended their search to stores in the area in the hopes of gathering evidence on who might have purchased the rope."
55,https://globalnews.ca/news/4956074/jussie-smollett-responds-accusations-he-lied-attack/,,Jussie Smollett responds to accusations he lied about attack,"['Katie Scott', 'Global News', 'Posted February']",https://shawglobalnews.files.wordpress.com/2019/02/gettyimages-1127060628.jpg?quality=70&strip=all&w=720&h=379&crop=1,"['smollett', 'responds', 'possible', 'jussie', 'empire', 'star', 'chicago', 'accusations', 'records', 'attack', 'phone', 'statement', 'lied']","Send this page to someone via email

Jussie Smollett said he redacted some information from his phone before giving it to Chicago police investigating a reported attack on the Empire actor in order to protect the privacy of contacts and people who are not relevant to the attack.

On Tuesday, the singer’s representatives issued a statement a day after police said the heavily redacted phone records he turned over to detectives this week were insufficient for a criminal investigation.

WATCH BELOW: ‘Nothing to indicate he is not being truthful with us’: Chicago police on Jussie Smollett attack

1:34 ‘Nothing to indicate he is not being truthful with us’: Chicago police on Jussie Smollett attack ‘Nothing to indicate he is not being truthful with us’: Chicago police on Jussie Smollett attack

“Jussie is the victim here, which has been stated by the Superintendent of Police,” the statement said. “Jussie has voluntarily provided his phone records from within an hour of the attack and given multiple statements to police. Chicago PD has repeatedly informed us that they find Jussie’s account of what happened that night consistent and credible.”

Story continues below advertisement

READ MORE: Jussie Smollett attack: Disturbing details emerge in new report

The statement is the latest in a back-and-forth between Smollett and police since he reported the attack in downtown Chicago on Jan. 29.

Police have made no arrests and said they have found no surveillance video that shows the attack. They have released video of two people in the area at the time who they said were persons of interest.

WATCH BELOW: Jussie Smollett, ‘Empire’ star, hospitalized following possible homophobic, racist attack

2:16 Jussie Smollett, ‘Empire’ star, hospitalized following possible homophobic, racist attack Jussie Smollett, ‘Empire’ star, hospitalized following possible homophobic, racist attack

Chicago police spokesman Anthony Guglielmi said Monday that the phone records turned over by Smollett are in a heavily redacted document file, and the records from the manager whom Smollett says he was talking to when the attack occurred, were a screenshot of phone calls. He says the records aren’t sufficient for an investigation.

Story continues below advertisement

READ MORE: Jussie Smollett performs for the first time since release from hospital

Smollett’s statement said he had good reasons for turning over limited information.

“Any redacted information was intended to protect the privacy of personal contacts or high-profile individuals not relevant to the attack,” his statement said.

Smollett, who is black and openly gay, told police that his attackers doused him with an unknown chemical substance, shouted racial and homophobic slurs at him, and looped a thin rope tied like a noose around his neck.

WATCH BELOW: Chicago police investigating possible hate crime against actor Jussie Smollett

1:33 Chicago police investigating possible hate crime against actor Jussie Smollett Chicago police investigating possible hate crime against actor Jussie Smollett

The Good Enough singer also told detectives that before they ran off, the attackers yelled, “This is MAGA country,” a reference to the “Make America Great Again” slogan which U.S. President Donald Trump uses.

Story continues below advertisement

The 36-year-old actor and his family have insisted that he has been truthful about the attack and his story has not changed since it happened.

Police have collected video surveillance footage from cameras in the downtown area and have also extended their search to stores in the area in the hopes of gathering evidence on who might have purchased the rope.

READ MORE: Jussie Smollett, ‘Empire’ star, hospitalized following possible homophobic, racist attack

The No Apologies singer has given his first interview about the attack, which will air on Good Morning America on Thursday morning.

In a brief promo for the interview, Smollett tears up after ABC’s Robin Roberts asked him if he feared for his life at any point during the attack.

TOMORROW: An @ABC EXCLUSIVE: @RobinRoberts sits down one-on-one with @JussieSmollett as he tells his story of being attacked in a vicious hate crime. See the interview TOMORROW on @GMA. pic.twitter.com/SuNowlrOTl — Good Morning America (@GMA) February 13, 2019

The interview is the first time the Empire star will answer questions on camera about his attack.

— With files from the Associated Press

Story continues below advertisement"
56,http://dailypundit.com/2019/02/13/breaking-hillary-clinton-hot-sauce-bottle-finally-found/,2019-02-13 00:00:00,BREAKING: Hillary Clinton Hot Sauce Bottle Finally Found! – Daily Pundit,"['View All Posts', 'Ken Mitchell', 'Bill Quick', 'Musical Mountaineer', 'About Bill Quick']",,"['hillary', 'smollett', 'sauce', 'hot', 'clinton', 'youre', 'chicago', 'daily', 'street', 'york', 'stairwell', 'finally', 'pundit', 'breaking', 'bottle', 'post']","0 ( 0 )

In case you’re wondering why the Chicago PD doesn’t just come out and say what everybody in the department and the local media knows is true, that Jussie Smollett is a lying sack of shit who false-flagged his imaginary beatings for his own PR:

The usual whackjobs will go nuts.

Student outrage after police protect University of Chicago from armed robbery suspects – The College Fix

If they did come out and charge Smollett with filing a false police report, which is what they should do, they figure the reaction from the SJRaceWarriors will be outrageous. So the better part of valor is to just pretend that they take NooseBoy seriously.

Here’s a couple of updates:

Why, indeed?

Also, Hillary Clinton’s Hot Sauce Bottle Found:

Jussie Smollett attack: New York Post reporters find bottle with bleach-smelling liquid along route taken by actor, police say | abc7chicago.com

The hot sauce bottle was partially filled with a clear liquid that smelled like bleach, according to a New York Post story confirmed by Chicago police. The Post claimed they found it near the foot of a stairwell to the Loews.

However, CPD spokesman Anthony Guglielmi said: “It’s unclear if that is related to the incident as it was not discovered during any of the earlier canvasses but we took it for analysis. The FBI is providing CPD with technical assistance on this case at our request. I’m not sure if the bottle went to their lab or one of ours.”

Jussie or his peeps wanted to use the last of their hot sauce on their Subway hoagie before putting in a bit of bleach and dropping off the bottle.

BTW, picture this amusing sequence: You’re walking down the street and you see a bottle of Frank’s Red Hot lying at the bottom of a stairwell (that would be below street/sidewalk level, by the way). So you trudge down the steps to examine this find more carefully. The piece of street detritus is so fascinating you pick it up and smell it carefully (wouldn’t anyone?). Voila! You detect a “smell like bleach.”

Obvious criminal evidence! You get the coppers NYPost immediately!

Just a good citizen, carrying out his duty to closely examine every bit of garbage, refuse, and detritus in all the stairwells along your daily stroll. As does everybody."
57,https://headlineplanet.com/home/2019/02/13/first-look-jussie-smollett-appears-for-interview-on-february-14-good-morning-america/,2019-02-13 00:00:00,First Look: Jussie Smollett Appears For Interview On February 14 “Good Morning America”,[],https://headlineplanet.com/home/wp-content/uploads/2019/02/Jussie-Smollett-GMA-Interview.jpg,"['morning', 'smollett', 'jussie', 'statement', 'look', 'interview', 'assault', 'chicago', 'week', 'turned', 'america', 'told', 'submitted', 'good', 'phone', '14', 'appears']","In its initial lineup announcement, ABC confirmed Mary J. Blige and Jessica Mulroney as guests for the February 14 “Good Morning America.”

They will not be the only celebrities to appear.

The episode will also feature an interview with Jussie Smollett.

Robin Roberts filmed said interview with the “Empire” star earlier this week. The discussion will mark Smollett’s first formal interview since reporting an assault in late January.

Smollett told police that he was attacked by two men in Chicago on January 29. The assault, as it was reported to authorities, included elements of a hate crime.

Police continue to investigate the matter. Smollett recently submitted phone records to assist with the investigation (he was allegedly on the phone with his manager at the onset of the attack), but a spokesperson for the Chicago Police Department says the material turned over was “insufficient to corroborate some of the information.”

The Smollett camp responded by noting that any redactions in the record were designed to protect high-profile individuals not involved in this particular matter.

The statement, moreover, declares, “Chicago PD has repeatedly informed us that they find Jussie’s account of what happened that night consistent and credible.”

A first-look at the GMA interview follows:"
58,https://www.heraldsun.com.au/entertainment/celebrity/empire-star-jussie-smollett-breaks-down-in-tv-interview-about-homophobic-attack/news-story/aa9941bd1977a7f8df7ed4d33f27f206,2019-02-13 14:56:00+00:00,Empire star Jussie Smollett breaks down with Robin Roberts over homophobic attack,[],https://cdn.newsapi.com.au/image/v1/51752e22e91d77bade72c9113883cc79,"['smollett', 'picture', 'roberts', 'breaks', 'jussie', 'star', 'empire', 'happened', 'chicago', 'homophobic', 'records', 'attack', 'phone', 'robin']","Empire star Jussie Smollett has broken down in his first TV interview about the homophobic attack that left him in hospital.

Smollett, 36, sat down with Robin Roberts on Good Morning America to discuss the assault that happened when he was walking home at 2am in Chicago last month.

media_camera Empire star Jussie Smollett. Picture: Supplied media_camera Jussie Smollett, right, and the cast of Empire. Picture: Supplied

The interview, which will air tomorrow, shows Smollett breaking down when Roberts asks if he feared for his life during the attack.

Chicago Police Department launched a hunt for his attackers who he said shouted “This is MAGA country!” after punching his ribs, pouring bleach on him and tying a noose around his neck.

media_camera Empire star Jussie Smollett, centre, and his family. Picture: Supplied

Smollett says he was on the phone with his manager, Brandon Z Moore, when the attack happened. Mr Moore says he heard the attackers yell “Empire f****t n****r” and shouting: “This is MAGA country!”

Smollett plays Jamal Lyon on Empire. Both he and his character are gay.

However, police say Smollett handed over heavily redacted phone records, which Chicago Police described as “insufficient proof” of the call.

media_camera Jussie Smollett, Taraji P. Henson, Grace Gealey and Trai Byers from Empire. Picture: Splash

A spokesman for Smollett said police did not express any concern to them about the phone records.

“Jussie has voluntarily provided his phone records from within an hour of the attack and given multiple statements to police. Chicago PD has repeatedly informed us that they find Jussie’s account of what happened that night consistent and credible. Superintendent Johnson has been clear from day one that Jussie is a victim,” he said.

“Any redacted information was intended to protect the privacy of personal contacts or high-profile individuals not relevant to the attack. Chicago Police have not told us that they are rejecting any records, nor have they expressed concerns about the records to us.”

Originally published as Empire star breaks down over attack"
59,https://chicago.suntimes.com/entertainment/jussie-smollett-gma-good-morning-america/,2019-02-13 20:37:00-06:00,‘Empire’ star Jussie Smollett tells GMA he’s ‘pissed off’ over doubters,"['Mitch Dudek', 'Andrews Mcmeel Syndication', 'Sun-Times Wire', 'Carly Behm', 'Georgia Nicols', 'Feb']",https://suntimesmedia.files.wordpress.com/2019/01/ap19029648632160-e1548800440699.jpg?w=970&h=630&crop=1,"['smollett', 'johnson', 'doubters', 'reported', 'jussie', 'star', 'empire', 'hes', 'interview', 'gma', 'manager', 'records', 'attack', 'victim', 'phone', 'tells', 'pissed']","Actor Jussie Smollett isn’t happy about the number of people who doubt his account of racist and homophobic attack he reported to Chicago police late last month.

“I’m pissed off,” he told “Good Morning America” anchor Robin Roberts, in a clip of an interview that was released in advance of an interview airing at 6 a.m. Thursday on ABC.

In another clip released by ABC ahead of the segment, Roberts asks: “What happened that night?”

Smollett’s answers are edited out of the clip. He also appears to well up with tears when asked: “At any point during the attack, did you fear for your life?”

Your browser does not support HTML5 video.

MORE ABOUT THE SMOLLETT CASE

• After giving redacted phone records, reps stress ‘Jussie is the victim here’

• Jussie Smollett on reported attack: ‘Justice will be served’

• Trump calls Jussie Smollett attack ‘horrible,’ family calls it ‘domestic terrorism’

Smollett has told police that on Jan. 29 he was walking in the 300 block of East North Water Street about 2 a.m. when two people walked up to him, yelled the slurs, hit him in the face, poured a substance — suspected to be bleach — on him, and put a “thin, light rope” around his neck.

Smollett initially was “reluctant” to call police because of the attention he would generate as a public figure, police said. But his manager eventually called at 2:42 a.m., about 40 minutes after the attack.

The actor said he was on the phone with his manager at the time of the attack. His manager has said that he could hear the attack and was able to hear the phrase “MAGA country” — the acronym from President Donald Trump’s “Make America Great Again” slogan. On Monday he gave the police redacted phone records; he has declined to turn over his phone.

Internet sleuths have cast aspersions on Smollett’s story since it was first reported, and an incomplete phone log may do little, if anything, to quell those doubts.

Smollet said in the interview to air Thursday that the “attacks” on his credibility after the incident have been hard to take.

He originally thought “if I tell the truth, that’s it, because it’s the truth. Oh, how can you doubt that?” he said. But then he realized many “don’t even want to see the truth.”

He also said he believes the images of two people that were seen on surveillance cameras the night of the attack are the ones who attacked him. Police have called them “persons of interest.”

“I don’t have any doubt in my mind that that’s them. Never did.” Why is he so sure? “Cause … I was there.”

Chicago Police Supt. Eddie Johnson said earlier this month that Smollett has been cooperative with detectives, and that the department is making progress in its investigation.

“We have no reason to think he’s not being genuine with us,” Johnson said. “The allegations that are described to us are horrendous, horrible and quite frankly cowardly. He is a victim, and we treat him like a victim.”

On Tuesday, after Chicago Police said the phone records that the actor had turned over were “insufficient for a criminal investigation,” representatives for Smollett issued a statement to reiterate that “Jussie is the victim here.”

“Chicago PD has repeatedly informed us that they find Jussie’s account of what happened that night consistent and credible,” Chris Bastardi, a spokesman for Smollett, said in an emailed statement. “Superintendent [Eddie] Johnson has been clear from day one that Jussie is a victim. We are continuing to work closely with the Chicago PD and remain confident that they will find Jussie’s attackers and bring them to justice.”"
60,https://www.news.com.au/entertainment/celebrity-life/empire-star-jussie-smollett-breaks-down-in-tv-interview-about-homophobic-attack/news-story/aa9941bd1977a7f8df7ed4d33f27f206,2019-02-13 14:56:00+00:00,Empire star Jussie Smollett breaks down with Robin Roberts over homophobic attack,['Staff Writers'],https://cdn.newsapi.com.au/image/v1/51752e22e91d77bade72c9113883cc79?width=650,"['smollett', 'roberts', 'breaks', 'jussie', 'star', 'empire', 'happened', 'redacted', 'chicago', 'homophobic', 'records', 'moore', 'attack', 'phone', 'robin']","Empire star Jussie Smollett has broken down in his first TV interview about the homophobic attack that left him in hospital.

Smollett, 36, sat down with Robin Roberts on Good Morning America to discuss the assault that happened when he was walking home at 2am in Chicago last month.

The interview, which will air tomorrow, shows Smollett breaking down when Roberts asks if he feared for his life during the attack.

Chicago Police Department launched a hunt for his attackers who he said shouted “This is MAGA country!” after punching his ribs, pouring bleach on him and tying a noose around his neck.

Smollett says he was on the phone with his manager, Brandon Z Moore, when the attack happened. Mr Moore says he heard the attackers yell “Empire f****t n****r” and shouting: “This is MAGA country!”

Smollett plays Jamal Lyon on Empire. Both he and his character are gay.

However, police say Smollett handed over heavily redacted phone records, which Chicago Police described as “insufficient proof” of the call.

A spokesman for Smollett said police did not express any concern to them about the phone records.

“Jussie has voluntarily provided his phone records from within an hour of the attack and given multiple statements to police. Chicago PD has repeatedly informed us that they find Jussie’s account of what happened that night consistent and credible. Superintendent Johnson has been clear from day one that Jussie is a victim,” he said.

“Any redacted information was intended to protect the privacy of personal contacts or high-profile individuals not relevant to the attack. Chicago Police have not told us that they are rejecting any records, nor have they expressed concerns about the records to us.”"
